{
  "schema_version": "figthread.export/0.1",
  "id": "export:minimal-pipeline-svg",
  "document_id": "document:minimal-pipeline",
  "target_id": "web-wide",
  "profile": "technical-explainer",
  "format": "svg",
  "frame": { "kind": "static-summary" },
  "background": "profile",
  "scale": 1,
  "live_text": true,
  "extensions": {}
}
